Id,Context,file_path
1c6338a9-3852-45d7-a17e-d8259b8c751a," The text does not provide any specific information about the programs offered by George Brown College. However, here are some factual information that can be extracted from the text:

- The convocation ceremony schedule can be checked by clicking through the tabs on the website.
- Interested individuals can sign up to receive application deadlines, college news, upcoming events, and tours information.
- George Brown College's contact information is as follows: phone number 416-415-2000, TTY number 1-877-515-5559, email address ask.george@georgebrown.ca, and social media hub.
- The website's contents are subject to change without notice and should not be viewed as a representation, offer, or warranty. Students are responsible for verifying George Brown College fee requirements.",scraped_pages/otherpages/Convocation Ceremonies Schedule | George Brown College.txt
