Id,Context,file_path
1705971359255313000," The text mentions several research programs and services offered at George Brown College:

1. Fashion Exchange: A one-stop-shop for fashion business needs, offering training, technologies, and services.
2. FIRSt: A team of food scientists, project managers, researchers, and chefs to help shape product concepts, support market research, and build products.
3. Interactive Design Exchange: Helps businesses adapt to Industry 4.0 by developing smart economy products, services, and systems.
4. Product Development Exchange: Connects Canadian industry to market-focused applied research for physical product innovation.
5. Social Innovation at George Brown: Enables researchers and students to work directly with communities, fostering innovation in various sectors and providing immersive learning experiences.
6. startGBC: Offers entrepreneurial best practices to help students develop skills from ideation to commercialization.
7. Land acknowledgment: Learn more about it by signing up for college news, application deadlines, events, tours, and other updates.
8. Contact Information: Phone number (416-415-2000) and TTY number (1-877-515-5559), email address (ask.george@georgebrown.ca), and social media hub.

Additionally, the text states that the information contained in the website is subject to change without notice and should not be viewed as a representation, offer, or warranty. Students are responsible for verifying George Brown College fee requirements.",scraped_pages/otherpages/Innovation Exchanges | George Brown College.txt
