Id,Context,file_path
1705971359622487000," Title: Interactive Media Management Program (Postgraduate) (G412)
Contact: Toni Allen <Toni.Allen@georgebrown.ca>
Online Information Session: Register to join ONLINE information session for the Interactive Media Management Program.
Methods of Contact: Email (Toni.Allen@georgebrown.ca), Phone (416-415-2000, TTY: 1-877-515-5559)
Website: ask.george@georgebrown.ca
Social Media Hub: Visit the Social Media Hub
Note: Information contained in the website is subject to change without notice. Students are responsible for verifying George Brown College fee requirements.
No further program-specific information was provided in the text.",scraped_pages/otherpages/Interactive Media Management Program (Postgraduate) (G412) - Information Sessions | George Brown College.txt
