Id,Context,file_path
1705971359219572000," Kizzy Rodney is the Associate Vice-President, External and Community Relations at George Brown College. She has been in this position since 2023. Before joining George Brown College in 2006, she worked with the University of Windsor on community-based research projects about social justice and poverty reduction. She also founded a life coaching and professional development company.

Kizzy's roles at George Brown College include Operations and Research Manager at the Community Partnerships Office, Strategic Development Manager in the division of Academic and Student Affairs, Director of the Community Partnerships Office, Director of Strategic Partnerships and Grants, and Director of External and Community Relations. She also taught at George Brown's School of Work and College Preparation and the School of Continuing Education and was an administrative representative on the George Brown College Board of Governors.

Kizzy earned a Master of Arts in Sociology from the University of Windsor and a Bachelor of Arts in Sociology from York University. She also received her life coaching certification from the Fowler Wainwright International Institute of Professional Coaching.

George Brown College's Community Partnerships Office oversees community engagement activities related to strategic projects that drive value into local communities and support economic growth. The college positions itself as a community-engaged campus, creating impact at personal, social, environmental, and educational levels.

Contact information for George Brown College: 416-415-2000, TTY: 1-877-515-5559, ask.george@georgebrown.ca.","scraped_pages/otherpages/Kizzy Rodney, Associate Vice-President, External and Community Relations | George Brown College.txt"
1705971359219573000," Phone number: 1-877-515-5559
Email address: ask.george@georgebrown.ca
Note: The text does not contain any information about the programs offered by George Brown College.","scraped_pages/otherpages/Kizzy Rodney, Associate Vice-President, External and Community Relations | George Brown College.txt"
