Id,Context,file_path
3096445a-45fd-4bbd-8bc7-7f7119b3bfaa," Leslie Quinlan currently holds the position of Senior Vice-President, People Enablement and Experience at George Brown College. Her responsibilities include information technology, infrastructure, people and culture, general counsel, and the Office of Anti-Racism, Equity and Human Rights Services. She aims to optimize teaching and learning environments for employees and students and shape the college's culture in line with Vision 2030 and Strategy 2022-2026.

From 2015 to 2021, Leslie served as Vice-President, HR and Public Safety and Security at George Brown College. During this period, she oversaw strategic and operational leadership for human resources and public safety and security. She also led the college's efforts as a top employer, focusing on anti-racism, equity, inclusivity, health, and wellness.

Before joining George Brown College, Leslie held various senior leadership positions in human resources within the financial services industry. At TD Bank Group, she was Senior Vice-President, HR, Corporate Office, and Direct Channels. Previously, she served as Vice-President, Talent Management and Vice-President, HR for TD Wealth Management.

Throughout her career, Leslie has been involved in community work, including leading the George Brown College United Way campaign for two years, being a member of the United Way Cabinet, chairing the Juvenile Diabetes Ride Foundation (JDRF), and representing the Industry Council for Homeward Bound.

Leslie holds an Honours Bachelor of Arts in Political Science and French from the University of Western Ontario and a Postgraduate Certificate in Industrial Relations from the University of Ottawa. She also completed the Advanced Human Resources Executive program at the University of Michigan.

George Brown College's contact information: 416-415-2000, TTY: 1-877-515-5559, ask.george@georgebrown.ca, and visit their Social Media Hub. Please note that the information contained in this website is subject to change without notice.",scraped_pages/otherpages/Leslie Quinlan | George Brown College.txt
db42a824-7afa-47c9-8229-c51241b0fae5, The text does not contain any factual key information related to the programs offered by George Brown College.,scraped_pages/otherpages/Leslie Quinlan | George Brown College.txt
