Id,Context,file_path
3ee4b818-dbad-4990-9825-02a4ec0c7a95," Program Name: Project Management Program (Postgraduate) B415
Sign Up Link: Sign Up Now
Application Inquiries Email: ask.george@ge Brown.ca
Phone Number: 416-415-2000 (TTY: 1-877-515-5559)
Social Media Hub: Visit Our Social Media Hub (mentioned twice in the text)
Note: Prerecorded information session for learning about the program and future career options, keeping updated with application deadlines, college news, upcoming events, tours, and more. The information on the website is subject to change without notice. Students are responsible for verifying George Brown College fee requirements.",scraped_pages/otherpages/Project Management Program (Postgraduate) B415 - Prerecorded Information Session | George Brown College.txt
