Id,Context,file_path
1706001799487365000," The George Brown College Library Learning Commons has made changes to its LLC Laptop Loan Policy as of December 18, 2023. Regarding accessibility, the college is in compliance with the Accessibility for Ontarians with Disabilities Act (AODA). Registered patrons with disabilities can request accessible or conversion ready formats of print-based resources held in the library's collection. This service does not include print material from special collections, archival materials, rare books, and donations.

For registered students, faculty, and staff with a perceptual disability as defined by the Canadian Copyright Act, accessible format copies of print material will be provided via the Accessible Content e-Portal (ACE). Eligible library patrons can request access to the ACE portal by emailing llcaccess@georgebrown.ca or phoning Andrea Hall at 416-415-5000, extension 4635. For more information on the ACE portal, please visit OCUL’s ACE page.

To request an accessible or conversion ready format of a book in the library's collection, fill out the form provided and submit it. Patrons currently registered with ACE can expect the accessible format to be placed in the ACE portal within 5-10 days, while those not registered will receive a response within 24 hours (Monday to Friday, between 9:00 and 5:00).

For questions or assistance, patrons can contact llcaccess@georgebrown.ca or Andrea Hall at 416-415-5000, extension 4635.",scraped_pages/otherpages/Requesting Accessible Formats for Print Based Resources | George Brown College.txt
1706001799487365000," Andrea Hall can be contacted at 416-415-5000, extension 4635. The college has multiple phone numbers: 416-415-2000 and TTY: 1-877-515-5559. The email address to contact is ask.george@georgebrown.ca. The text mentions a ""Social Media Hub"" but no specific links or details are provided. The college's website information is subject to change without notice and students are responsible for verifying George Brown College fee requirements.",scraped_pages/otherpages/Requesting Accessible Formats for Print Based Resources | George Brown College.txt
