Id,Context,file_path
1705971359418901000," George Brown College and Wealthsimple announced a new partnership with a $20,000 gift to fund a new student award. Wealthsimple currently provides work-integrated learning opportunities and hires George Brown graduates. A scholarship of $5,000 will be given each year for four years.

The scholarship announcement was made during a visit by a team from George Brown College and the Student Association to the Wealthsimple headquarters in downtown Toronto. Attendees included George Brown President Dr. Gervan Fearon, Vice-President, Advancement and Foundation President Dr. Cindy Gouveia, Wealthsimple CEO Mike Katchen, and recent George Brown graduate Layo Folami who works at the Wealthsimple Foundation as a Community Engagement Coordinator.

The Wealthsimple Foundation, an organization dedicated to breaking down barriers to post-secondary education, is headed by Leen Yong Li, who sits on the George Brown College Foundation’s Board of Directors as Chair of the Finance and Investment Committees. The Wealthsimple Foundation funds student bursaries and helps modest-income families access Canada Learning Bond funding.

The partnership between George Brown College and Wealthsimple aims to provide access to education and opportunities for students, with Wealthsimple currently offering rich work-integrated learning experiences and great career opportunities for George Brown graduates.","scraped_pages/otherpages/Wealthsimple Foundation donation funds new $20,000 student entrance scholarship | George Brown College.txt"
1705971359418902000," The Wealthsimple Foundation CLB (Canada Learning Bond) Entrance Scholarship will be available starting in the 2022/23 academic year. The recipient will receive a $5,000 award each year until the 2025/26 academic year for a total maximum value of $20,000. Eligible students can apply for this award by visiting the How to Apply for Awards and Scholarships Page.

The scholarship is offered by the Wealthsimple Foundation. The Canada Learning Bond (CLB) is money that the government adds to a Registered Education Savings Plan (RESP) for children from modest-income families.

To be eligible for this award, students must meet certain criteria. The details of these criteria are provided in the text. The remainder of the scholarship, if not fully disbursed before the $20,000 limit is reached, will be disbursed to another eligible student who will receive an annual award of $5,000.

Morolayo Folami, a recent graduate from the Digital Media Marketing program at George Brown College's Centre for Business, spoke at an event about her passion for supporting access to education and her pride in working with purpose-driving organizations like the Wealthsimple Foundation. Folami completed her program co-op at the Wealthsimple Foundation and continues in a role there.

Students can learn more about the college's land acknowledgment, sign up for updates, and contact George Brown College using the provided phone number, email address, or social media hub. The information on this website is subject to change without notice.","scraped_pages/otherpages/Wealthsimple Foundation donation funds new $20,000 student entrance scholarship | George Brown College.txt"
1705971359418902000," Based on the given text, there is no specific information related to fee requirements or the program offered by the college that can be extracted. Therefore, the output should be an empty text.","scraped_pages/otherpages/Wealthsimple Foundation donation funds new $20,000 student entrance scholarship | George Brown College.txt"
