Id,Context,file_path
1705971359221158000," The text provides information on various services and applications offered by George Brown College for students. Here are the key factual information extracted from the text:

1. George Brown College app is available for Apple and Android devices, providing class locations, grades, important dates, special deals for students, and allowing users to join the Student Service Centre queue or lodge IT help requests on the go.
2. IT Support is available 24/7 for the learning management system Brightspace and other college applications like STU-View, email, password resets, mobile app, and wifi. Technical support can also be sought in person at the Help Desk at any campus Library Learning Commons (LLC).
3. AppsAnywhere is a free service that allows George Brown students, staff, and faculty to access software on-demand, anytime, and anywhere.
4. Students can skip the line all over campus by ordering food ahead through the Boost mobile ordering app and pick up at their own schedule.
5. George Brown College provides free access to Office 365 for full-time students, including Word, Powerpoint, Excel, and one terabyte of cloud-based storage through Microsoft Online. Access is available to currently registered students and up to one year after the last registered course.
6. Full-time George Brown students can access thousands of online tutorials for free through LinkedIn Learning in various subjects like audio, business, marketing, motion graphics, programming, and writing courses.
7. Students can sign up to receive updates on application deadlines, college news, upcoming events, tours, and more.
8. Contact information for George Brown College includes a phone number (416-415-2000), TTY number (1-877-515-5559), email address (ask.george@georgebrown.ca), and social media hub.
9. The information on the website is subject to change without notice, and students are responsible for verifying George Brown College fee requirements.","scraped_pages/otherpages/Websites, Apps and Technical Support | George Brown College.txt"
